,Article Headlines,Article URLs,Keywords,Similarity Weights
36,"OpenAI hit by staff exits as it seeks to restructure and raise new fundsChief technology officer Mira Murati and two research leaders announced their departures Wednesday. The company is exploring a new structure that could help raise new funding.September 26|||Three more execs out at OpenAI, including technology chief Mira Murati|||OpenAI reportedly looking to strip control from nonprofit board, go for-profit in restructuring",https://www.washingtonpost.com/technology/2024/09/25/openai-mira-murati-departure-leaves/|||https://www.cnn.com/2024/09/25/tech/openai-technology-chief-mira-murati-leaving/index.html|||https://www.foxbusiness.com/technology/openai-reportedly-looking-ditch-non-profit-control-3-more-execs-leave,mira|||murati|||new|||openai|||technology,0.667047768831253
37,"As Hurricane Milton threatens the US, Helene could cost property owners more than $47 billion|||Florida businesses fear Hurricane Milton will worsen Helene 'devastation'|||Hurricane Milton aims at Florida as Helene recovery continues",https://www.cnn.com/2024/10/07/business/property-damange-hurricane-helene-47-billion/index.html|||https://www.foxbusiness.com/media/florida-businesses-fear-hurricane-milton-worsen-helene-devastation-looks-like-third-world-country|||https://www.washingtonpost.com/weather/2024/10/06/fema-hurricane-florida-milton-helene/,florida|||helene|||hurricane|||milton,0.6574042737483978
38,"Arizona Supreme Court rules voters caught in proof-of-citizenship glitch can still get ‘full ballot,’ including state races|||Oregon mistakenly registered hundreds more voters without proving citizenship|||Number of Arizona voters missing citizenship proof doubles",https://www.cnn.com/2024/09/20/politics/arizona-supreme-court-citizenship-voting/index.html|||https://www.foxnews.com/politics/oregon-mistakenly-registered-hundreds-more-voters-without-proving-citizenship|||https://www.washingtonpost.com/politics/2024/09/30/adrian-fontes-arizona-noncitizen-voters/,arizona|||citizenship|||proof|||voter,0.6540890038013458
39,"Federal judge backs Biden in battle over student loan handouts as election nears|||Federal judge temporarily blocks Biden’s student loan forgiveness planSeven Republican-led states sued to block the Biden administration from advancing a plan to forgive the interest on the federal student loans of 25 million Americans.By Danielle Douglas-GabrielSeptember 6, 2024|||Judge Halts Biden Student Debt Plan Right After It Was Allowed to Proceed",https://www.foxbusiness.com/politics/federal-judge-hands-biden-win-republicans-challenge-student-loan-bailout|||https://www.washingtonpost.com/education/2024/09/05/federal-court-blocks-biden-student-loan-forgiveness-plan/|||https://www.nytimes.com/2024/10/04/us/politics/biden-student-debt-missouri.html,biden|||federal|||judge|||loan|||plan|||student,0.6524073481559753
40,"The best mortgage interest rates today: October 7, 2024|||Today's 15- and 30-year mortgage rates hold at lowest level in over a year | August 13, 2024|||Mortgage rates are coming down — and home buyers are ready to pounceHomebuyers are rushing to take advantage of lower mortgage rates following the Federal Reserve’s recent interest rate cut.By Abha Bhattarai and Rachel SiegelSeptember 19, 2024",https://www.cnn.com/cnn-underscored/money/mortgage-interest-rates-today-10-07-2024|||https://www.foxbusiness.com/personal-finance/todays-mortgage-rates-august-13-2024|||https://www.washingtonpost.com/business/2024/09/19/mortgage-rates-drop-fed-cut-homebuyers-refinancing/,low|||mortgage|||rate|||today|||year,0.6518769264221191
41,"Afghan national charged with Election Day terrorist plot in US|||Afghan man arrested in Okla., accused of plotting Election Day attackNasir Ahmad Tawhedi is accused of working with his brother-in-law, a minor, to target large gatherings in the United States on Nov. 5 in the name of ISIS.By Perry SteinOctober 8, 2024|||Afghan Man Arrested on Charges of Plotting Election Day Attack",https://www.cnn.com/2024/10/08/politics/isis-terrorism-arrest-oklahoma-election-day/index.html|||https://www.washingtonpost.com/national-security/2024/10/08/oklahoma-isis-afghan-election-day-plot-fbi/|||https://www.nytimes.com/2024/10/08/us/politics/election-day-attack-afghanistan-isis.html,afghan|||day|||election|||man,0.6493745446205139
42,"Tampa Bay Buccaneers heading to New Orleans early to avoid Hurricane Milton|||Hurricane Milton's path takes it through Tampa, Orlando airports, airlines are impacted|||Why the Tampa Bay area is especially vulnerable as Hurricane Milton nears",https://www.cnn.com/2024/10/08/sport/tampa-bay-buccaneers-new-orleans-hurricane-milton-spt-intl/index.html|||https://www.foxbusiness.com/lifestyle/hurricane-miltons-path-takes-through-tampa-orlando-airports-airlines-impacted|||https://www.washingtonpost.com/climate-environment/2024/10/07/tampa-bay-flood-risk/,bay|||hurricane|||milton|||tampa,0.6488880515098572
43,"October 7, 2024, presidential campaign news|||Fox News Digital's News Quiz: October 4, 2024|||Trump: So what?October 4",https://www.cnn.com/politics/live-news/trump-harris-election-10-07-24/index.html|||https://www.foxnews.com/lifestyle/fox-news-digitals-news-quiz-october-4-2024|||https://www.washingtonpost.com/opinions/2024/10/04/ann-telnaes-cartoon-donald-trump/,news|||october,0.6482528746128082
44,"Helene flooding strands hundreds of North Carolina residents as storm’s death toll reaches 95|||North Carolina residents will see changes to early voting after Hurricane Helene|||In North Carolina, there was before Helene. This is the after.“A hundred years from now, they will be talking about this flood,” said one resident in Western North Carolina, where the extent of the disaster is only beginning to emerge.By Brady Dennis, Scott Dance, Dino Grandoni, Gerrit De Vynck and Brianna SacksOctober 6, 2024",https://www.cnn.com/2024/09/29/weather/hurricane-helene-florida-georgia-carolinas-sunday/index.html|||https://www.foxnews.com/politics/north-carolina-residents-see-changes-early-voting-after-hurricane-helene|||https://www.washingtonpost.com/weather/interactive/2024/north-carolina-hurricane-helene-before-aftermath-georgia/,carolina|||helene|||north|||resident,0.6451874077320099
45,Smart moves to make when the Fed starts cutting rates|||Fed cuts interest rates for first time in 4 years – here's what that means for your wallet|||The Fed cuts rates,https://www.cnn.com/2024/07/27/success/fed-interest-rate-cuts-debt-savings/index.html|||https://www.foxbusiness.com/personal-finance/federal-reserve-interest-rate-cut|||https://www.washingtonpost.com/opinions/2024/09/19/ramirez-cartoon-fed-interest-rates/,fed|||rate,0.6416402161121368
46,"Trump, who has criticized Jewish Democrats, blames their party for antisemitismBy Carmen Sesin and Sabrina Rodriguez|||Fox News ‘Antisemitism Exposed’ Newsletter: Jewish students vow to 'walk proudly' on grim anniversary|||Trump Sees Antisemitism in Only One Direction: On the Left",https://www.washingtonpost.com/politics/2024/10/07/trump-antisemitism-democrats-republicans/|||https://www.foxnews.com/us/fox-news-antisemitism-exposed-newsletter-jewish-students-vow-walk-proudly-grim-anniversary|||https://www.nytimes.com/2024/10/07/us/politics/trump-antisemitism-oct7.html,antisemitism|||jewish|||trump,0.6415120661258698
47,The VP debate is an example of Kamala Harris’s horrible judgment when it comes to picking staff|||Maya Rudolph as Kamala Harris can’t handle VP candidates ‘vibing’ during spoof debate on ‘SNL’|||Kamala Harris defies critics on policy and politicsOpinion by Jennifer Rubin,https://www.foxnews.com/opinion/morning-glory-vp-debate-example-kamala-harriss-horrible-judgment-when-comes-picking-staff|||https://www.cnn.com/2024/10/06/entertainment/vp-candidates-vibing-snl-cold-open/index.html|||https://www.washingtonpost.com/opinions/2024/09/27/newsletter-harris-economic-policy-voters/,debate|||harris|||kamala|||vp,0.6400067806243896
48,"Ukraine’s east buckling under improved Russian tactics, superior firepowerIn an arc of villages south of Pokrovsk, including Vuhledar, battlefields that have been stagnant for two and a half years are showing more movement than ever — in Russia’s favor.By Alex Horton and Serhii KorolchukOctober 2, 2024|||Ukraine wants to fire Western long-range weapons into Russia. But the battlefield gain is not clear-cut|||Ukrainian stronghold Vuhledar falls to Russian offensive after two years of bombardment",https://www.washingtonpost.com/world/2024/10/02/ukraine-russia-advance-pokrovsk-vuhledar/|||https://www.cnn.com/2024/09/22/europe/ukraine-western-long-range-weapons-russia-intl/index.html|||https://www.foxnews.com/world/ukrainian-stronghold-vuhledar-falls-russian-offensive-after-two-years-bombardment,battlefield|||russia|||russian|||ukraine|||vuhledar|||year,0.6384090185165405
49,Kamala Harris defies critics on policy and politicsOpinion by Jennifer Rubin|||Kamala Harris needs to beat the fundamentals to win|||Kamala Harris' tough words on Iran confounds critics,https://www.washingtonpost.com/opinions/2024/09/27/newsletter-harris-economic-policy-voters/|||https://www.cnn.com/2024/10/05/politics/kamala-harris-trump-election-fundamentals/index.html|||https://www.foxnews.com/politics/harris-iran-biggest-us-adversary-china,critic|||harris|||kamala,0.6377027332782745
50,"October 7, 2024’s student loan rates|||Private student loan interest rates rise for 5- and 10-year terms|||$167.3 billion in student loan forgivenessThe Biden administration has canceled $167.3 billion in student loans for 4.7 million borrowers as of May. This student loan forgiveness tracker explains how.By Danielle Douglas-GabrielAugust 30, 2024",https://www.cnn.com/cnn-underscored/money/student-loan-rates-10-07-2024|||https://www.foxbusiness.com/personal-finance/private-student-loan-rates-september-11-2024|||https://www.washingtonpost.com/education/2024/08/30/biden-student-loan-forgiveness-tracker/,loan|||rate|||student,0.6338786482810974
51,Head of Natl Weather Service on Hurricane Milton|||Hurricane Milton to intensify and swell in size before unleashing on Florida and more top headlines|||Hurricane Milton nears Florida coast as thousands evacuate2 hours ago,https://www.cnn.com/2024/10/08/us/video/the-lead-hurricane-milton-ken-graham-florida-evacuation-destruction-jake-tapper|||https://www.foxnews.com/us/hurricane-milton-intensify-swell-size-before-unleashing-florida-more-top-headlines|||https://www.washingtonpost.com/weather/2024/10/08/hurricane-milton-florida-evacuations-warnings/,florida|||hurricane|||milton,0.6311202049255371
52,Business groups call on Biden to intervene in port strike|||Biden may face tough choices as port strike continues|||Ports Rush to Reopen After First Major Strike in Decades Is Suspended,https://www.foxbusiness.com/economy/business-groups-call-biden-intervene-port-strike|||https://www.washingtonpost.com/business/2024/10/02/port-strike-biden-election/|||https://www.nytimes.com/2024/10/04/business/economy/dockworkers-strike-ports-reopen.html,biden|||port|||strike,0.6291389465332031
53,"Russian court sentences US citizen to six years in prison for fighting for Ukraine, state media reports|||Russia jails American Stephen Hubbard over fighting as a mercenary in Ukraine|||Russia sentences U.S. citizen to nearly 7 years for fighting for UkraineStephen Hubbard, who moved to Ukraine in 2014, was captured by Russian soldiers in Izyum in April 2022, and was charged with serving in a territorial defense unit.By Mary IlyushinaOctober 7, 2024",https://www.cnn.com/2024/10/07/europe/russian-court-sentences-us-citizen-stephen-hubbard-intl/index.html|||https://www.foxnews.com/world/russia-jails-american-stephen-hubbard-over-fighting-mercenary-ukraine|||https://www.washingtonpost.com/world/2024/10/07/russia-stephen-hubbard-ukraine-convicted-mercenary/,citizen|||hubbard|||russia|||russian|||ukraine|||year,0.629095584154129
54,"Fact check: New Trump attack ad deceptively edits out key words from Harris and The New York Times|||AnalysisPro-Trump group attacks Harris for murder that took place 14 years agoThe ad features a mother who also appeared in a Trump 2016 campaign ad concerning illegal immgrationBy Glenn KesslerSeptember 3, 2024|||Inside a Harris Ad in Which Ex-Trump Aides Blast Him as Unfit for Office",https://www.cnn.com/2024/10/04/politics/fact-check-trump-ad-harris-taxes/index.html|||https://www.washingtonpost.com/politics/2024/09/03/pro-trump-group-attacks-harris-murder-that-took-place-14-years-ago/|||https://www.nytimes.com/2024/10/08/us/politics/harris-ad-former-trump-aides-unfit.html,ad|||harris|||new|||trump,0.6235447824001312
55,"The iPhone 16 isn’t selling as well as Apple may have hoped|||Apple unveils the iPhone 16|||Apple to unveil iPhone 16, new Watches and AirPods. Here’s what to expect.September 9",https://www.cnn.com/2024/09/30/tech/iphone-16-presales-apple-intelligence/index.html|||https://www.foxbusiness.com/technology/apple-unveils-iphone-16|||https://www.washingtonpost.com/technology/2024/09/09/apple-event-2024-iphone-preview-reveal-apple-watch/,apple|||iphone,0.6212702989578247
56,"See past interviews with suspect in apparent Trump assassination attempt|||Trump reveals new details of first assassination attempt in exclusive interview: 'It was the craziest day'|||AnalysisFact-checking 55 suspect claims, mostly Trump’s, in debate with HarrisTrump, on the defensive, makes four times more suspect claims than Harris.By Glenn KesslerSeptember 11, 2024",https://www.cnn.com/2024/09/16/politics/video/ryan-routh-interviews-ukraine-digvid|||https://www.foxnews.com/media/trump-reveals-new-details-first-assassination-attempt-exclusive-interview-craziest-day|||https://www.washingtonpost.com/politics/2024/09/11/fact-check-presidential-debate-harris-trump/,assassination|||attempt|||claim|||interview|||suspect|||trump,0.6182003915309906
57,"A year into the war, Israeli military operations in Gaza continue to ramp up and Hamas is yet to be defeated|||Israel has momentum in its battle with Hezbollah. But what comes next?Israel is racking up military wins against its regional foes. But fighting multiple wars will take its toll, and experts wonder what the long-term strategy is.By Steve Hendrix, Claire Parker, Karen DeYoung and Abbie CheesemanOctober 6, 2024|||I Live in Israel. I Never Hear About What My Country Is Doing to Gaza.",https://www.cnn.com/2024/10/08/middleeast/isael-gaza-one-year-hamas-fighting-hnk-intl/index.html|||https://www.washingtonpost.com/world/2024/10/06/israel-hezbollah-lebanon-iran/|||https://www.nytimes.com/2024/10/07/opinion/israel-gaza-apathy-indiference.html,gaza|||israel|||military|||war,0.6170948445796967
58,"Helene response hampered by misinformation, conspiracy theories|||False claims about the federal response to Helene are an ominous sign for the coming election|||CHUCK DEVORE: Comparing Biden-Harris bungled Helene response to past disasters",https://www.washingtonpost.com/weather/2024/10/05/hurricane-helene-conspiracy-theories-rumors/|||https://www.cnn.com/2024/10/05/media/hurricane-helene-fema-false-claims-recovery/index.html|||https://www.foxnews.com/opinion/chuck-devore-biden-harris-bungled-response-hurricane-helene-leaves-americans-suffer,helene|||response,0.6169122159481049
59,"Helene left at least 128 people dead and communities ‘wiped off the map.’ Now, survivors are struggling to get food and water|||My Appalachia family survived Helene. We need to ensure they can still vote|||Rescue and recovery extend deeper into areas ravaged by HeleneAt least 154 have died as a result of Helene, but officials say the death toll will remain fluid, with many only saying they expect numbers to rise.By Nicolás Rivero, Allyson Chiu, Molly Hennessy-Fiske, Kim Bellware, Brady Dennis and Emily Wax-ThibodeauxOctober 2, 2024",https://www.cnn.com/2024/09/30/weather/hurricane-helene-recovery-cleanup-monday/index.html|||https://www.foxnews.com/opinion/appalachia-family-survived-helene-need-ensure-can-still-vote|||https://www.washingtonpost.com/weather/2024/10/02/hurricane-helene-aftermath-north-carolina-floods-georgia-damage/,helene,0.6154955625534058
60,"How Harris could secure a historic winning record for Democrats in November – and still lose|||New poll shows Harris taking a slim lead over Trump thanks to support from a surprising group|||AnalysisMore voters expect Harris to win. Here’s why that could actually matter.Polls increasingly show voters predicting a Harris victory. Some research suggests that people are actually pretty good at predicting these things.By Aaron BlakeSeptember 19, 2024",https://www.cnn.com/2024/10/08/politics/democrats-popular-vote-kamala-harris-analysis/index.html|||https://www.foxnews.com/politics/new-poll-shows-harris-taking-slim-lead-over-trump-support-from-surprising-group|||https://www.washingtonpost.com/politics/2024/09/19/more-voters-expect-harris-win-heres-why-that-could-actually-matter/,harris|||voter,0.6109032332897186
61,Biden admin's response to Hurricane Milton could be 'huge potential problem' for Harris campaign: CNN guest|||Biden postpones foreign travel due to Hurricane Milton|||Biden and Harris visit storm-ravaged areasOctober 2,https://www.foxnews.com/media/biden-admins-response-hurricane-milton-could-huge-potential-problem-harris-campaign-cnn-guest|||https://www.cnn.com/2024/10/08/politics/joe-biden-postponed-trip-milton/index.html|||https://www.washingtonpost.com/politics/2024/10/02/biden-harris-hurricane-helene/,biden|||harris|||hurricane|||milton,0.6100033819675446
62,NASA captures Hurricane Milton timelapse in space|||Disney World shutting its gates ahead of Hurricane Milton|||Hurricane Milton tracker: Map and projected storm path,https://www.cnn.com/2024/10/08/weather/video/hurricane-milton-nasa-timelapse-contd-digvid|||https://www.foxbusiness.com/lifestyle/walt-disney-world-universal-orlando-closing-hurricane-milton|||https://www.washingtonpost.com/weather/2024/10/08/hurricane-milton-path-tracker-map/,hurricane|||milton,0.6095573604106903
63,The challenges Floridians are facing while trying to evacuate|||Hurricane Milton evacuations in Florida: What to pack ahead of the storm|||Why these Floridians are fleeing Milton after some refused to evacuate last time,https://www.cnn.com/2024/10/08/us/florida-evacuation-milton-challenges/index.html|||https://www.foxnews.com/travel/hurricane-milton-evacuations-florida-what-to-pack-storm|||https://www.washingtonpost.com/weather/2024/10/08/florida-evacuations-hurricane-milton-helene/,floridian|||milton,0.6084255874156952
64,"Republicans are challenging all aspects of mail-in voting in battleground states|||AnalysisTroubling signs for the GOP on mail votingRepublican leaders have pushed for their party to embrace early and mail voting, despite Trump’s attacks on it. Voters appear to be taking their cues from him.By Aaron BlakeSeptember 25, 2024|||Voting Wars Open a New Front: Which Mail Ballots Should Count?",https://www.cnn.com/2024/10/08/politics/mail-in-ballot-republican-lawsuits-battleground-states/index.html|||https://www.washingtonpost.com/politics/2024/09/25/troubling-signs-gop-mail-voting/|||https://www.nytimes.com/2024/10/08/us/election-mail-in-ballot-rejection.html,mail|||voting,0.6082887649536133
65,"These are the states where abortion rights will – or could – be on the ballot in November|||AnalysisPolls show big increase in Republicans planning to vote for abortion rightsIn some states, that GOP number could even approach a majority.By Aaron BlakeSeptember 30, 2024|||Poll Finds Support for Florida’s Abortion Ballot Measure Is Falling Short",https://www.cnn.com/2024/04/28/politics/state-abortion-ballot-measure-vote-dg/index.html|||https://www.washingtonpost.com/politics/2024/09/30/polls-show-big-increase-republicans-planning-vote-abortion-rights/|||https://www.nytimes.com/2024/10/08/us/politics/florida-abortion-ballot-measure-poll.html,abortion|||ballot|||state,0.6059019565582275
66,"Fact check: Walz makes false claims about Trump on abortion and the economy|||IRS data challenges Walz's claim that Trump tax cuts 'predominantly went to the top guys'|||AnalysisFact-checking the VP debate between Vance and WalzVance dominated on the falsehood meter, with faulty claims on lost children, the environment, inflation, immigration and the Jan. 6 attack. By Glenn KesslerOctober 2, 2024",https://www.cnn.com/2024/10/07/politics/fact-check-walz-false-claims-trump-abortion-economy/index.html|||https://www.foxbusiness.com/media/irs-data-challenges-walzs-claim-over-trump-tax-cuts-predominantly-went-top-guys|||https://www.washingtonpost.com/politics/2024/10/02/fact-check-vp-debate-vance-walz/,claim|||trump|||walz,0.6048015058040619
67,"I’ve tracked the best PS5 deals for 4 years. Here are 12 that stood out for Prime Day 2024|||Amazon Prime Big Deal Days: Here are some of the biggest discounts on sale now|||ColumnThe new PlayStation 5 Pro is $700. Is it worth it?Sony’s long-awaited PS5 Pro releases Nov. 7. Here’s a buyer’s guide based on what we know so far.By Gene ParkSeptember 10, 2024",https://www.cnn.com/cnn-underscored/deals/best-ps5-deals-amazon-prime-day-2024-10-08|||https://www.foxnews.com/lifestyle/amazon-prime-dig-deal-days-top-deals|||https://www.washingtonpost.com/entertainment/video-games/2024/09/10/playstation-5-pro-price-specs/,big|||day|||deal|||prime|||pro|||ps5,0.5977278351783752
68,"The latest on the 2024 campaign|||The 'October surprise' that could bend the arc of the 2024 election is already here|||AnalysisFact-checking Day 3 of the 2024 Democratic National ConventionSpeakers made claims about Project 2025, Trump’s tax cuts, and job creation under post-Cold War presidents.By Glenn KesslerAugust 22, 2024",https://www.cnn.com/politics/live-news/trump-harris-election-10-08-24/index.html|||https://www.foxnews.com/opinion/trump-vs-harris-october-surprise-already-here|||https://www.washingtonpost.com/politics/2024/08/22/dnc-fact-check-democratic-national-convention-day-3/,campaign|||late|||arc|||election|||october|||surprise|||analysisfact|||claim|||cold|||conventionspeaker|||creation|||cut|||day|||democratic|||glenn|||job|||kessleraugust|||national|||post|||presidents|||project|||tax|||trump|||war,0.5929377973079681
69,"Benjamin Netanyahu's Churchill moment comes amid multifront war against Iranian terror, expert says|||Netanyahu vows to continue Hezbollah war, defying U.S. cease-fire plan|||Behind the War of Words Between Macron and Netanyahu",https://www.foxnews.com/world/benjamin-netanyahus-churchill-moment-comes-amid-multi-front-war-against-iranian-terror-expert-says|||https://www.washingtonpost.com/national-security/2024/09/27/netanyahu-un-speech-israel-hezbollah/|||https://www.nytimes.com/2024/10/07/world/europe/macron-netanyahu-weapons.html,netanyahu|||war,0.5902707874774933
70,"Less than 10 days after Helene made landfall, Florida braces for another hurricane, potentially a Category 3|||FEMA administrator fires back at Hurricane Helene critics: We've been on the ground before it hit Florida|||Hurricane Helene means a rainy Friday for the D.C. area, and an unsettled weekendUpdated September 26",https://www.cnn.com/2024/10/05/weather/tropical-storm-milton-florida-gulf-of-mexico/index.html|||https://www.foxnews.com/media/fema-administrator-fires-back-hurricane-helene-critics-weve-been-ground-before-hit-florida|||https://www.washingtonpost.com/weather/2024/09/25/helene-dc-weather-rain/,florida|||helene|||hurricane,0.5866804420948029
71,"Dress Codes: How the pussy-bow blouse became a political staple for Kamala Harris and other powerful women|||All of Kamala Harris’ interviews have been ‘embarrassingly unimpressive’: Rich Lowry|||A designer favored by Kamala Harris embraces lingerie and liberationChloé’s beautiful Paris Fashion Week collection showcased the way the Kamala Harris-favored brand has tapped into the freedom with which young women dress now.By Rachel TashjianSeptember 27, 2024",https://www.cnn.com/2024/10/08/style/kamala-harris-pussy-bow-blouse/index.html|||https://video.foxbusiness.com/v/6363007271112|||https://www.washingtonpost.com/style/fashion/2024/09/27/designer-favored-by-kamala-harris-embraces-lingerie-liberation/,harris|||kamala|||woman,0.5861314535140991
72,"AnalysisWhy is Melania Trump coming out for abortion rights?The left sees political strategy in the former first lady’s sudden, unequivocal statements backing abortion rights. But there are simpler explanations.By Aaron BlakeOctober 3, 2024|||See where abortions are banned and legal — and where it’s still in limbo|||Melania Trump says former President Trump was aware of her abortion stance 'since the day we met'",https://www.washingtonpost.com/politics/2024/10/03/why-is-melania-trump-coming-out-abortion-rights/|||https://www.cnn.com/us/abortion-access-restrictions-bans-us-dg/index.html|||https://www.foxnews.com/media/melania-trump-former-president-trump-aware-abortion-stance-since-day-met,abortion|||melania|||trump,0.5856980979442596
73,"The 13 best TV and streaming deals our tech editors found on Amazon Prime Day 2024|||Amazon Prime Big Deal Days: Electronic deals that are too good to miss|||What Netflix has learned from its push into video gamesThe world’s biggest streamer wants to be a one-stop entertainment shop. Will its audience follow?By Gene ParkJune 26, 2024",https://www.cnn.com/cnn-underscored/deals/best-tv-deals-amazon-prime-day-2024-10-08|||https://www.foxnews.com/lifestyle/electronic-deals-amazon-prime-big-deal-days|||https://www.washingtonpost.com/entertainment/video-games/2024/06/26/netflix-games-expansion/,amazon|||big|||day|||deal|||good|||prime,0.5841453671455383
