,Article Headlines,Article URLs,Keywords,Similarity Weights
0,"Supreme Court signals it may uphold Biden’s regulations on ‘ghost gun’ kits|||Supreme Court signals support for Biden administration regulation of 'ghost gun' kits|||What’s at stake in the Supreme Court ghost gun case being heard TuesdayA U.S. judge in Texas ruled the Biden administration exceeded its authority in requiring serial numbers, sales records and background checks for ghost guns.By Justin JouvenalOctober 7, 2024|||Majority of Supreme Court Appears Receptive to Biden Administration Limits on ‘Ghost Guns’",https://www.cnn.com/2024/10/08/politics/supreme-court-ghost-guns/index.html|||https://www.foxnews.com/politics/supreme-court-signals-support-biden-administration-regulation-ghost-gun-kits|||https://www.washingtonpost.com/politics/2024/10/07/ghost-gun-case-supreme-court/|||https://www.nytimes.com/2024/10/08/us/ghost-guns-supreme-court.html,administration|||biden|||court|||ghost|||gun|||kit|||regulation|||supreme,1.8635401278734207
1,"Trump and Harris’ proposals would both increase the national debt but Trump’s plan would add $4 trillion more, study finds|||Harris says wealthy Americans, corporations will pay higher taxes to fund economic plan|||Trump would add twice as much to national debt as Harris, study finds|||Trump’s Plans Could Increase U.S. Debt While Raising Costs for Most Americans",https://www.cnn.com/2024/10/07/politics/debt-harris-trump-proposals/index.html|||https://www.foxnews.com/media/harris-says-wealthy-americans-corporations-will-pay-higher-taxes-to-fund-economic-plan|||https://www.washingtonpost.com/business/2024/10/07/trump-harris-national-debt/|||https://www.nytimes.com/2024/10/07/us/politics/trump-economic-plans-debt-costs.html,americans|||debt|||harris|||national|||plan|||study|||trump,1.6380200386047363
2,"Biden says Israel shouldn’t strike Iranian nuclear sites, but US officials recognize it has a right to respond to attack|||Biden says he would not back Israeli strike on Iran's nuclear sites|||White House vows consequences for Iran’s attack on Israel|||Washington Worries the Israelis Will Bomb Iran’s Nuclear Sites. But Can They?",https://www.cnn.com/2024/10/02/politics/biden-israel-iran-response/index.html|||https://www.foxnews.com/politics/biden-says-he-would-not-back-israeli-strike-irans-nuclear-sites|||https://www.washingtonpost.com/national-security/2024/10/01/iran-israel-biden/|||https://www.nytimes.com/2024/10/07/us/politics/israel-iran-nuclear-facilities-strikes.html,biden|||iran|||israel|||nuclear|||site,1.5744587928056717
3,"Massive Israeli airstrikes hit 120 targets in Lebanon. See video of explosion in Beirut|||Israeli military kills 250 Hezbollah terrorists since start of limited ground operation in Lebanon|||As Israel escalates in Lebanon, U.S. influence is limitedSeptember 30|||Israel Sends More Soldiers Into Lebanon as Strikes Hit Beirut and Damascus",https://www.cnn.com/2024/10/08/world/video/israel-airstrikes-lebanon-targets-digvid|||https://www.foxnews.com/world/israeli-military-kills-250-hezbollah-terrorists-since-start-limited-ground-operation-lebanon|||https://www.washingtonpost.com/national-security/2024/09/30/us-israel-lebanon-hezbollah/|||https://www.nytimes.com/2024/10/08/world/middleeast/israel-lebanon-gaza-syria.html,beirut|||israel|||israeli|||lebanon,1.4766232520341873
4,Promises Kamala Harris has made so far in her campaign|||Kamala Harris’ support with Arab and Muslim communities in Michigan is ‘tenuous’: Democratic strategist|||Comparing where Kamala Harris and Donald Trump stand on key policy positionsUpdated September 17|||Kamala Harris Is Turning a Trump Tactic on Its Head,https://www.cnn.com/interactive/2024/08/politics/kamala-harris-key-issues-dg/|||https://www.foxnews.com/media/kamala-harris-support-arab-muslim-communities-michigan-tenuous-democratic-strategist|||https://www.washingtonpost.com/politics/interactive/2023/presidential-candidates-2024-policies-issues/|||https://www.nytimes.com/2024/10/06/opinion/kamala-harris-donald-trump-security.html,harris|||kamala|||trump,1.4751361906528473
5,"Fact check: Six days of Trump lies about the Hurricane Helene response|||Trump addresses criticism he's politicizing Hurricane Helene: 'Anything I do, they'll say, oh, it's political'|||Helene response hampered by misinformation, conspiracy theories|||What Trump and Vance Want From Hurricane Helene",https://www.cnn.com/2024/10/06/politics/fact-check-trump-helene-response-north-carolina/index.html|||https://www.foxnews.com/media/trump-addresses-criticism-hes-politicizing-helene-anything-i-do-theyll-say-oh-its-political|||https://www.washingtonpost.com/weather/2024/10/05/hurricane-helene-conspiracy-theories-rumors/|||https://www.nytimes.com/2024/10/08/opinion/helene-trump-vance-fema.html,helene|||hurricane|||response|||trump,1.4425858408212662
6,"Hezbollah publicly endorses Lebanon ceasefire efforts for the first time as Israel ramps up offensive|||1 year after Hezbollah strikes, Israel reinforces troops and questions mount over ‘limited’ operation|||As Israel escalates in Lebanon, U.S. influence is limited|||What We Know About the Israeli Forces Fighting in Lebanon",https://www.cnn.com/2024/10/08/middleeast/hezbollah-endorses-lebanon-ceasefire-first-time-israel-war-intl/index.html|||https://www.foxnews.com/politics/one-year-after-hezbollah-strikes-israel-reinforces-troops-questions-mount-over-limited-operation|||https://www.washingtonpost.com/national-security/2024/09/30/us-israel-lebanon-hezbollah/|||https://www.nytimes.com/2024/10/08/world/middleeast/israel-military-lebanon.html,hezbollah|||israel|||lebanon|||limited,1.44011789560318
7,"How to help Hurricane Helene victims|||Those suffering from Hurricane Helene's impact get help from Rev. Franklin Graham and Samaritan's Purse|||About 100 rescued animals from Hurricane Helene find shelter in VirginiaTwo local organizations, Homeward Trails and District Dogs, partnered to care for the animals while they await adoption.By Afia BarrieOctober 5, 2024|||Asheville, Tampa and Lessons From Hurricane Helene",https://www.cnn.com/us/how-to-help-helene-storm-victims-iyw/index.html|||https://www.foxnews.com/lifestyle/franklin-graham-samaritans-purse-help-suffering-hurricane-helene|||https://www.washingtonpost.com/dc-md-va/2024/10/05/helene-rescued-animals-dc-va/|||https://www.nytimes.com/2024/10/08/opinion/hurricane-helene.html,animal|||helene|||hurricane,1.4373077899217606
8,"Israel marks the anniversary of October 7 terror attacks with tears and anger|||One-year anniversary of Oct. 7 attacks arrives with lasting trauma for Israelis, American Jews: expert|||White House vows consequences for Iran’s attack on IsraelUpdated October 1|||Tuesday Briefing: Israelis and Palestinians Mourn a Year of Loss",https://www.cnn.com/2024/10/07/middleeast/israel-anniversary-october-7-hamas-attacks-intl-latam/index.html|||https://www.foxnews.com/politics/one-year-anniversary-oct-7-attacks-arrives-lasting-trauma-israelis-american-jews-expert|||https://www.washingtonpost.com/national-security/2024/10/01/iran-israel-biden/|||https://www.nytimes.com/2024/10/07/briefing/oct-7-anniversary-harris-lifespan.html,anniversary|||attack|||israelis|||october|||year,1.3868466764688492
9,Trump ramps up politicization around storm relief ahead of Hurricane Milton|||Biden admin's response to Hurricane Milton could be 'huge potential problem' for Harris campaign: CNN guest|||What is making Hurricane Milton so ferocious|||Biden Warns Floridians to ‘Evacuate Now’ as He Postpones Foreign Trip Over Hurricane Milton,https://www.cnn.com/2024/10/07/politics/video/trump-ramps-up-politicization-around-storm-relief-ahead-of-hurricane-milton|||https://www.foxnews.com/media/biden-admins-response-hurricane-milton-could-huge-potential-problem-harris-campaign-cnn-guest|||https://www.washingtonpost.com/climate-environment/interactive/2024/hurricane-milton-helene-marine-heat-wave-storms/|||https://www.nytimes.com/2024/10/08/us/politics/biden-trip-hurricane-milton.html,biden|||hurricane|||milton,1.3613664507865906
10,"Here’s how Asheville and North Carolinians are showing up for each other after Helene|||Couple narrowly escapes Hurricane Helene's fury in NC mountains as mudslide just misses car|||How Helene became a ‘worst case scenario’What fueled Helene and caused so much devastation in North CarolinaBy Simon Ducroquet, John Muyskens, Naema Ahmed, Nicolás Rivero and Niko KommendaOctober 5, 2024|||How Helene Has Upended North Carolina’s Election Plans",https://www.cnn.com/2024/10/06/us/north-carolina-residents-helping-helene-victims/index.html|||https://www.foxnews.com/media/couple-narrowly-escapes-hurricane-helenes-fury-nc-mountains-mudslide-just-misses-car|||https://www.washingtonpost.com/climate-environment/interactive/2024/helene-flooding-damage-north-carolina-chimney-rock/|||https://www.nytimes.com/2024/10/08/us/north-carolina-election-hurricane-helene.html,helene|||north,1.3237812370061874
11,"‘Shocking,’ historic spike in anti-Jewish threats across the US, ADL says|||New report finds nearly 200% increase in antisemitic incidents in US since Oct. 7 Hamas terror massacre|||American Jews cope with the fallout a year after the Oct. 7 attacksBy Michelle Boorstein|||Antisemitism and Threats Directed at Officials Over Storm Response",https://www.cnn.com/2024/10/06/us/anti-jewish-threats-us-adl/index.html|||https://www.foxnews.com/world/new-report-finds-nearly-200-increase-antisemitic-incidents-in-us-since-oct-7-hamas-terror-massacre|||https://www.washingtonpost.com/world/2024/10/07/american-jews-antisemitism-israel-gaza-attacks-anniversary/|||https://www.nytimes.com/2024/10/08/us/north-carolina-floods-antisemitic-social-media.html,oct|||threat,1.304873138666153
12,"What’s the latest news about the Trump-Harris race? It depends on who you ask|||Fox News Politics: Harris' Heavy Hitter|||AnalysisKamala Harris’s what-can-you-do-for-me problemA new poll gets at a significant disconnect in the 2024 race. Voters like Harris and even her policies, but they see themselves better off under Trump.By Aaron BlakeSeptember 23, 2024|||Harris, in Michigan, Tries to Head Off Trump’s Attacks Over Gas Cars",https://www.cnn.com/2024/09/29/politics/breakthrough-polling-project-trump-harris-springfield/index.html|||https://www.foxnews.com/politics/fox-news-politics-newsletter-harris-heavy-hitter|||https://www.washingtonpost.com/politics/2024/09/23/kamala-harriss-what-can-you-do-for-me-problem/|||https://www.nytimes.com/2024/10/04/us/politics/kamala-harris-trump-gas-cars-evs-michigan.html,harris|||news|||race|||trump,1.2881594896316528
13,"Trump vows to ‘remove the Jew haters’ if reelected during event commemorating October 7 attacks|||One year after 10/7 attacks and Democrat-run states have let antisemitism fester|||Trump, who has criticized Jewish Democrats, blames their party for antisemitismBy Carmen Sesin and Sabrina Rodriguez|||Oct. 7: For Jews in America, a Time of Reflection",https://www.cnn.com/2024/10/08/politics/trump-remove-jew-haters-october-7-event/index.html|||https://www.foxnews.com/opinion/one-year-after-10-7-attacks-democrat-run-states-have-let-antisemitism-fester|||https://www.washingtonpost.com/politics/2024/10/07/trump-antisemitism-democrats-republicans/|||https://www.nytimes.com/2024/10/07/opinion/jews-antisemitism-oct7.html,attack|||democrat|||trump,1.2336260676383972
14,5 takeaways from Kamala Harris’ one-on-one interview with ‘60 Minutes’|||5 key takeaways from Kamala Harris' '60 Minutes' interview|||7 Takeaways From Harris’s Interview on ‘60 Minutes’,https://www.cnn.com/2024/10/07/politics/takeaways-kamala-harris-60-minutes/index.html|||https://www.foxnews.com/politics/5-key-takeaways-from-kamala-harris-60-minutes-interview|||https://www.nytimes.com/2024/10/07/us/politics/kamala-harris-60-minutes-interview-takeaways.html,harris|||interview|||kamala|||minute|||takeaway,0.8570637702941895
15,"Famed Cuban, MLB pitcher Luis Tiant dies at 83|||Ex-MLB star Luis Tiant dead at 83|||Luis Tiant, the charismatic Cuban who pitched the Red Sox to the brink of a championship, dies at 83Luis Tiant has died at the age of 83By Jimmy Golen | APOctober 8, 2024",https://www.cnn.com/2024/10/08/sport/cuban-mlb-pitcher-luis-tiant-dies-spt-intl/index.html|||https://www.foxnews.com/sports/ex-mlb-star-luis-tiant-dead|||https://www.washingtonpost.com/sports/mlb/2024/10/08/luis-tiant-dies-red-sox/f3f018e4-858e-11ef-8274-e0558282750d_story.html,cuban|||luis|||mlb|||tiant,0.8399566411972046
16,"US budget deficit hits $1.8 trillion for fiscal 2024, per CBO|||U.S. deficit hits $1.8 trillion as interest costs riseRising interest costs have swelled the U.S. deficit, prompting concerns about a potential debt crisis.By Jacob BogageOctober 8, 2024|||U.S. Budget Deficit Rises to $1.8 Trillion in 2024",https://www.cnn.com/2024/10/08/politics/us-federal-budget-national-deficit/index.html|||https://www.washingtonpost.com/business/2024/10/08/federal-budget-deficit-financial-health/|||https://www.nytimes.com/2024/10/08/us/politics/us-budget-deficit-2024.html,budget|||cost|||deficit,0.8398260772228241
17,‘Here we go again’: Hurricane Milton strengthens to Category 3 and aims at Helene-weary Florida|||VARNEY: Hurricanes Milton and Helene are churning 'serious' long-term effects|||Hurricane Milton aims at Florida as Helene recovery continuesOctober 6,https://www.cnn.com/2024/10/06/weather/tropical-storm-milton-florida-sunday/index.html|||https://www.foxbusiness.com/media/stuart-varney-hurricanes-milton-helene-churning-serious-long-term-effects|||https://www.washingtonpost.com/weather/2024/10/06/fema-hurricane-florida-milton-helene/,florida|||helene|||hurricane|||milton,0.7818572223186493
18,Netanyahu confirms Hezbollah's pick to replace Nasrallah as leader is dead: ‘thousands of terrorists’ killed|||Hasan Nasrallah is gone. But the threat of Hezbollah remains.Opinion by Max Boot|||Netanyahu Suggests Israel Killed Likely Replacements for Hezbollah’s Leader,https://www.foxnews.com/world/netanyahu-confirms-nasrallahs-replacement-dead-thousands-terrorists-killed|||https://www.washingtonpost.com/opinions/2024/09/28/hasan-nasrallah-hezbollah-airstrike-killed/|||https://www.nytimes.com/2024/10/08/world/middleeast/netanyahu-hezbollah-nasrallah-replacement.html,hezbollah|||leader|||nasrallah|||netanyahu,0.7762849628925323
19,"TikTok sued by 14 attorneys general over alleged harm to children’s mental health|||States sue TikTok, saying its addictive features hook children|||TikTok Faces Barrage of Lawsuits Around Teens and Mental Health",https://www.cnn.com/2024/10/08/tech/tiktok-sued-14-states-childrens-mental-health/index.html|||https://www.washingtonpost.com/technology/2024/10/08/tiktok-sued-states-lawsuit-children-addiction/|||https://www.nytimes.com/2024/10/08/business/tiktok-lawsuits-us-states-teens-mental-health.html,child|||health|||mental|||tiktok,0.7615256905555725
20,"‘Truthfully, only a fool would stay.’ Floridians head inland as Hurricane Milton’s fury nears|||Coastal Floridian warns others to 'get out' as Hurricane Milton closes in: 'We have no idea' what's coming|||Hurricane Milton nears Florida coast as thousands evacuateAmid dire warnings and predictions of giant storm surges, Floridians puzzled over how far to flee was far enough — or whether to flee at all.By Molly Hennessy-Fiske, Joshua Partlow, Bryan Pietsch, Jason Samenow and Karin BrulliardOctober 8, 2024",https://www.cnn.com/2024/10/08/us/evacuations-helene-milton-inland-florida/index.html|||https://www.foxnews.com/media/florida-braces-milton-coastal-resident-warns-others-get-no-idea-coming|||https://www.washingtonpost.com/weather/2024/10/08/hurricane-milton-florida-evacuations-warnings/,floridian|||hurricane|||milton,0.7530280351638794
21,"Biden moves to replace all lead pipes within the next decade|||In landmark move, EPA requires removal of all U.S. lead pipes in a decade|||Biden Requires Lead Drinking-Water Pipes to be Replaced Nationwide",https://www.cnn.com/2024/10/08/politics/lead-pipes-joe-biden/index.html|||https://www.washingtonpost.com/climate-solutions/2024/10/08/epa-lead-pipe-removal-rule-drinking-water/|||https://www.nytimes.com/2024/10/08/climate/biden-epa-lead-pipes.html,biden|||decade|||lead|||pipe,0.7182273268699646
22,"Nearly 1,500 Florida gas stations have run out of fuel. Hurricane Milton could cause even more trouble|||Hurricane Milton drives gas shortage in Florida as residents flee storm|||Hurricane Milton nears Florida coast as thousands evacuateOctober 8",https://www.cnn.com/2024/10/08/business/hurricane-milton-florida-gasoline-shortages/index.html|||https://www.foxbusiness.com/economy/hurricane-milton-drives-gas-shortage-florida-residents-flee-storm|||https://www.washingtonpost.com/weather/2024/10/08/hurricane-milton-florida-evacuations-warnings/,florida|||gas|||hurricane|||milton,0.7172248363494873
23,"Museum worker mistakes beer can artwork for garbage, tosses in trash|||Museum’s beer can artwork accidentally thrown in trash by staff member|||Art or Trash? It Can Be a Fine Line.",https://www.foxnews.com/travel/museum-worker-mistakes-beer-can-artwork-garbage-tosses-trash|||https://www.cnn.com/2024/10/08/style/beer-can-artwork-trash-scli-intl/index.html|||https://www.nytimes.com/2024/10/08/arts/beer-can-art-lam-museum-thrown-out.html,beer|||museum|||trash,0.7145426869392395
24,"Ancient remains of Egyptian army barracks and a bronze sword unearthed by archaeologists|||Ancient sword from the era of Moses, Book of Exodus uncovered in Egypt|||Sword with pharaoh’s mark found in Egypt, still shimmering 3,000 years laterThe bronze sword was unearthed by archaeologists at an ancient fort in the Nile Delta. It was emblazoned with the signature emblem of Ancient Egyptian pharaoh Ramses II.By Leo SandsSeptember 19, 2024",https://www.cnn.com/2024/09/17/science/egypt-army-barracks-sword-intl-scli/index.html|||https://www.foxnews.com/lifestyle/ancient-sword-era-moses-book-exodus-uncovered-egypt|||https://www.washingtonpost.com/history/2024/09/19/ancient-egypt-military-sword-archaeology-fort/,ancient|||archaeologist|||bronze|||egypt|||egyptian|||pharaoh|||sword,0.7133552134037018
25,‘Godfather of AI’ shares Nobel Prize in physics for work on machine learning|||Pioneers of AI win Nobel Prize in physics for laying the groundwork of machine learning|||Nobel Physics Prize Awarded for Pioneering A.I. Research by 2 Scientists,https://www.cnn.com/2024/10/08/science/nobel-prize-physics-hopfield-hinton-machine-learning-intl/index.html|||https://www.foxnews.com/science/pioneers-ai-win-nobel-prize-physics-laying-groundwork-machine-learning|||https://www.nytimes.com/2024/10/08/science/nobel-prize-physics.html,ai|||learning|||machine|||nobel|||physics|||prize,0.7080546021461487
26,"Harris says there’s not much she’d have done differently than Biden over the last 4 years|||Kamala Harris tells 'The View' she can't think of anything she would have done differently from Biden|||On differences with Biden, Harris says ‘not a thing that comes to mind’",https://www.cnn.com/politics/harris-2024-campaign-biden/index.html|||https://www.foxnews.com/media/kamala-harris-tells-the-view-she-cant-think-anything-she-would-have-done-differently-from-biden|||https://www.washingtonpost.com/politics/2024/10/08/harris-biden-differences-view-howard-stern/,biden|||harris,0.6970256567001343
27,"CNN Instant Poll: No clear winner in VP debate between Tim Walz and JD Vance|||Why Vance easily beat Walz in debate, softening his image in the process|||VP debate moderators clarify, press and cut the mics once, for JD VanceCBS News anchors Norah O’Donnell and Margaret Brennan were more facilitators than fact-checkers during the vice-presidential debate between Sen. JD Vance (R-Ohio) and Gov. Tim Walz (D-Minn.).By Jeremy BarrOctober 1, 2024",https://www.cnn.com/2024/10/02/politics/election-poll-walz-vance-debate/index.html|||https://www.foxnews.com/politics/why-vance-easily-beat-walz-debate-softening-his-image-process|||https://www.washingtonpost.com/style/media/2024/10/01/vp-debate-walz-vance-norah-odonnell-margaret-brennan-cbs/,debate|||jd|||tim|||vance|||vp|||walz,0.6942124962806702
28,"Mauricio Pochettino unveiled as US men’s head coach|||Mauricio Pochettino kicks off new USMNT era with 'tough' and 'intense' training session|||USMNT finally gets its coach: Mauricio Pochettino finalizes long-awaited dealKnown for nurturing young players and deploying proactive tactics, Pochettino will take over a U.S. team that has less than two years to prepare for the World Cup.By Steven GoffSeptember 10, 2024",https://www.cnn.com/2024/09/13/sport/video/pochettino-riddell-intv-091305pseg1-cnni-sports-fast|||https://www.foxnews.com/sports/mauricio-pochettino-kicks-off-new-usmnt-era-tough-intense-training-session|||https://www.washingtonpost.com/sports/2024/09/10/mauricio-pochettino-usmnt-coach/,coach|||mauricio|||pochettino,0.6871777176856995
29,Why the Tampa Bay area is especially vulnerable as Hurricane Milton nearsOctober 7|||Hurricane Milton strengthens to Category 2: What Floridians need to know|||Hurricane Milton has Florida homeowners and the insurance market bracing for impact,https://www.washingtonpost.com/climate-environment/2024/10/07/tampa-bay-flood-risk/|||https://www.cnn.com/2024/10/07/weather/video/hurricane-milton-category-two-florida-storm-update-ctm-digvid|||https://www.foxbusiness.com/economy/hurricane-milton-has-florida-homeowners-insurance-market-bracing-impact,hurricane|||milton,0.6773462295532227
30,"Walz says Electoral College ‘needs to go’ at California fundraiser|||Vance, Walz didn't sway undecided voters. Campaigns must do 2 things to close the deal|||Walz Says the Electoral College ‘Needs to Go’",https://www.cnn.com/2024/10/08/politics/walz-electoral-college-needs-to-go/index.html|||https://www.foxnews.com/opinion/vance-walz-didnt-sway-undecided-voters-week-candidates-must-do-2-things-close-deal|||https://www.nytimes.com/2024/10/08/us/politics/tim-walz-electoral-college.html,college|||electoral|||walz,0.6768545210361481
31,"WNBA Rookie of the Year Caitlin Clark set to participate in LPGA golf event in November|||Caitlin Clark Wins WNBA Rookie Of The Year One Vote Shy Of Unanimous Because Someone Picked Angel Reese|||Caitlin Clark to tee it up in LPGA pro-am at The AnnikaCaitlin Clark wasn’t entirely joking when she included golf in her offseason plansBy Associated PressOctober 7, 2024",https://www.cnn.com/2024/10/08/sport/caitlin-clark-lpga-pro-am-spt-intl/index.html|||https://www.outkick.com/sports/caitlin-clark-wins-wnba-rookie-year-angel-reese|||https://www.washingtonpost.com/sports/golf/2024/10/07/caitlin-clark-gainbridge-lpga-proam-annika/cc2d2a2e-84d8-11ef-8274-e0558282750d_story.html,caitlin|||clark|||golf|||lpga|||rookie|||wnba|||year,0.6763393878936768
32,Qantas apologizes after R-rated film plays on every screen during Sydney-Tokyo flight|||Passengers horrified after airline plays explicit movie on every screen|||Qantas Apologizes for Showing R-Rated Film With Nudity to Entire Flight,https://www.cnn.com/2024/10/07/travel/qantas-r-rated-movie-inflight-daddio-intl-hnk/index.html|||https://www.foxbusiness.com/fox-news-world/passengers-horrified-airline-plays-explicit-movie-every-screen-super-uncomfortable|||https://www.nytimes.com/2024/10/08/business/qantas-airlines-australia-r-rated-movie.html,apologize|||film|||flight|||qanta|||screen,0.6752594709396362
33,"Disney World and other major Florida tourist attractions closing ahead of Milton|||Walt Disney World, Universal Orlando closing for Hurricane Milton|||Hurricane Milton nears Florida coast as thousands evacuate",https://www.cnn.com/travel/disney-world-closing-florida-milton/index.html|||https://www.foxbusiness.com/lifestyle/walt-disney-world-universal-orlando-closing-hurricane-milton|||https://www.washingtonpost.com/weather/2024/10/08/hurricane-milton-florida-evacuations-warnings/,disney|||florida|||hurricane|||milton|||world,0.6731294691562653
34,"Fact check: No evidence for Trump’s claim he has been to Gaza|||Morning Glory: Trump stands with Israel|||Trump Says He’s Visited Gaza, but No Record of Such a Trip Exists",https://www.cnn.com/2024/10/08/politics/trump-gaza-fact-check/index.html|||https://www.foxnews.com/opinion/morning-glory-trump-stands-israel|||https://www.nytimes.com/2024/10/07/us/politics/trump-gaza-israel.html,gaza|||trump,0.6692872643470764
35,"Harris says Trump’s putting politics over people with his hurricane response: ‘He really lacks empathy on a very basic level’|||Ron DeSantis says Harris has 'no role' in hurricane response: 'I don't have time for political games'|||On ‘The View,’ Harris Hits at Trump’s ‘Callousness’ in His Storm Response",https://www.cnn.com/2024/10/08/politics/kamala-harris-donald-trump-hurricane-milton/index.html|||https://www.foxnews.com/media/ron-desantis-says-harris-has-no-role-hurricane-preparation-i-dont-have-time-political-games|||https://www.nytimes.com/2024/10/08/us/politics/harris-the-view-interview-trump.html,harris|||hurricane|||response|||trump,0.6684955358505249
