,Article Headlines,Article URLs,Keywords,Similarity Weights
74,"EARLY BRIEFAnalysisHarris multiplied Biden’s lead among young votersIn today’s edition … Romney declines to endorse Harris over ideological differences ... DNC to spend in every U.S. state and territory.By Theodoric Meyer, Leigh Ann Caldwell and Alec DentSeptember 27, 2024|||SEAN HANNITY: Harris and Biden have been completely missing in action|||Romney Won’t Endorse Harris, Saying He Wants to Keep His Voice in the Party",https://www.washingtonpost.com/politics/the-briefs-newsletters/early-brief/|||https://www.foxnews.com/media/sean-hannity-harris-biden-have-been-completely-missing-action|||https://www.nytimes.com/2024/10/08/us/politics/mitt-romney-trump-harris.html,biden|||harris|||romney,0.5833833515644073
75,"Elon Musk’s ballooning wealth|||Elon Musk’s X is worth nearly 80% less than when he bought it, Fidelity estimates|||Oracle's Larry Ellison is getting richer, rivaling Musk, Bezos, Zuckerberg",https://www.washingtonpost.com/opinions/2024/09/13/cartoon-pritchett-elon-musk-trillionaire/|||https://www.cnn.com/2024/10/02/business/elon-musk-twitter-x-fidelity/index.html|||https://www.foxbusiness.com/technology/oracles-larry-ellison-getting-richer-rivaling-musk-bezos-zuckerberg,elon|||musk,0.5833290815353394
76,"Democrats dominate spending on political ads – except on Elon Musk’s X|||Harris’ cash edge funds advertising blitz as Elon Musk cuts big check to House Republicans, new filings show|||Trump and Republicans Bet Big on Anti-Trans Ads Across the Country",https://www.washingtonpost.com/technology/2024/10/07/musk-trump-x-ads/|||https://www.cnn.com/2024/09/21/politics/fundraising-harris-trump-elon-musk/index.html|||https://www.nytimes.com/2024/10/08/us/politics/trump-republican-transgender-ads.html,ad|||big|||elon|||musk|||republicans,0.5822916328907013
77,"KFile: Before his MAGA conversion, Vance indicated that Biden won the 2020 election legitimately|||Stuart Varney: JD Vance's debate victory might swing the election|||Vance refuses to say Trump lost in 2020, sparking debate’s biggest clash",https://www.cnn.com/2024/10/08/politics/kfile-vance-2020-election/index.html|||https://www.foxbusiness.com/media/stuart-varney-jd-vances-debate-victory-might-swing-election|||https://www.washingtonpost.com/politics/2024/10/01/jd-vance-trump-2020-election-loss-debate/,debate|||election|||vance,0.5820702314376831
78,"Biltmore Village near famous estate ravaged by Hurricane Helene: Before and after|||What Hurricane Helene’s 500-mile path of destruction looks like|||Hurricane damage puts further strain on rural areas in GeorgiaTowns like Bartow, Ga., already were suffering before Helene lashed them with 75-mph winds. Now farmers face another effort to rebuild.By Allison SalernoOctober 4, 2024",https://www.foxbusiness.com/lifestyle/biltmore-village-near-famous-estate-ravaged-hurricane-helene-before-after|||https://www.cnn.com/2024/10/01/weather/hurricane-helene-path-of-destruction-climate-dg/index.html|||https://www.washingtonpost.com/weather/2024/10/04/georgia-agriculture-helene-damage/,helene|||hurricane,0.5816322267055511
79,"Iran’s missile attack on Israel raises questions about limits of arsenalIran’s missile attack on Israel this week stood out for its large scope and limited impact. Some analysts say it calls into question the value of Iran’s arsenal.By Adam Taylor and Meg KellyOctober 5, 2024|||Reporter's Notebook: Iran’s missiles strike Israel, and a deadly terror attack in Tel Aviv|||China Buys Nearly All of Iran’s Oil Exports, but Has Options if Israel Attacks",https://www.washingtonpost.com/world/2024/10/05/iran-missiles-attack-israel-deterrence/|||https://www.foxnews.com/world/reporters-notebook-irans-missiles-strike-israel-deadly-terror-attack-tel-aviv|||https://www.nytimes.com/2024/10/04/business/iran-oil-sales-china.html,attack|||iran|||israel|||missile|||question,0.5804578363895416
80,"DeSantis and Biden speak on storm recovery after reports GOP governor hadn’t returned calls from president, vice president|||Biden undermines Harris claim that Ron DeSantis is politicizing hurricane response: 'Doing a great job'|||Biden calls for putting ‘politics aside’ in visit to storm-ravaged Florida, GeorgiaOctober 3",https://www.cnn.com/2024/10/07/politics/desantis-harris-biden-hurricane-recovery-calls/index.html|||https://www.foxnews.com/politics/biden-undermines-harris-claim-ron-desantis-politicizing-hurricane-response-doing-great-job|||https://www.washingtonpost.com/politics/2024/10/03/biden-hurricane-georgia-florida/,biden|||desantis|||president|||storm,0.5803914368152618
81,Putin issues nuclear warning to the West over strikes on Russia from Ukraine|||Lithuanian FM warns Russia can do 'so much damage to its neighbors'|||Zelensky warns U.N. that Russia is preparing to attack nuclear plantsUpdated September 25,https://www.cnn.com/2024/09/25/europe/putin-nuclear-warns-west-missile-strikes-ukraine-intl-latam/index.html|||https://www.foxnews.com/world/lithuanian-fm-warns-russia-can-do-so-much-damage-its-neighbors|||https://www.washingtonpost.com/national-security/2024/09/25/zelensky-un-russia-victory-plan/,nuclear|||russia,0.5775873959064484
82,Letter from the EditorClimate Solutions spotlights the work of people confronting the challenge of climate change and helps readers understand how they can make a difference as individuals.By Matt Murray|||Meet NASA’s newest tool to fight climate change|||An Artist Rethinks Climate Change in Words and Pictures,https://www.washingtonpost.com/climate-solutions/2024/09/17/letter-editor-matt-murray-climate/|||https://www.cnn.com/2024/09/03/climate/video/nasa-sea-robot-climate-change-antarctic-ice-weir-digvid|||https://www.nytimes.com/2024/10/06/opinion/climate-change-solutions.html,change|||climate,0.5757192373275757
83,"MSNBC's Steele claims Trump's the one not doing media as GOP ticket does 3x more interviews than Harris-Walz|||Photographers say Harris campaign has reduced their accessIn a letter, the White House News Photographers Association claims the Harris campaign hasn’t made room for the same number of photographers who traveled with the president.By Laura WagnerSeptember 12, 2024|||Harris Should Offer to Debate Trump Again — on Fox",https://www.foxnews.com/media/msnbcs-steele-claims-trumps-one-not-doing-media-gop-ticket-does-3x-more-interviews-than-harris-walz|||https://www.washingtonpost.com/style/media/2024/09/12/photographers-object-after-harris-campaign-reduces-their-access/|||https://www.nytimes.com/2024/10/02/opinion/kamala-debate-fox-news.html,campaign|||harris|||photographer|||trump,0.5726047158241272
84,"What an Escalating Middle East Conflict Could Mean for the Global Economy|||Oil prices rise as Middle East tensions escalate, markets hedge against $100 a barrel surge|||Tension in the Middle East looms over Biden’s last big U.N. meetingUpdated September 23",https://www.nytimes.com/2024/10/05/business/dealbook/israel-iran-global-economy.html|||https://www.foxbusiness.com/markets/oil-prices-rise-middle-east-tensions-escalate-markets-hedge-against-100-barrel-surge|||https://www.washingtonpost.com/politics/2024/09/23/biden-unga-israel-iran/,east|||middle|||tension,0.5694571733474731
85,"Howard Stern tells Harris sun will 'go out' if she loses: 'We're in for the darkest skies on the planet'|||Harris appears on ‘The View,’ with Howard Stern, Stephen ColbertUpdated 1 hour ago|||Harris Spends an Hour in the Warm Embrace of Howard Stern",https://www.foxnews.com/media/howard-stern-tells-harris-sun-go-out-she-loses-were-darkest-skies-planet|||https://www.washingtonpost.com/elections/2024/10/08/2024-election-campaign-updates-harris-trump/|||https://www.nytimes.com/2024/10/02/opinion/harris-howard-stern.html,harris|||hour|||howard|||stern,0.5665048956871033
86,"These Pennsylvania voters illustrate Harris’ suburban challenge|||Axelrod says ‘upscale’ NC Harris voters will find way to vote after storm, not sure about rural Trump fans|||Harris, Trump in tense battle over Puerto Rican voters in PennsylvaniaSeptember 13",https://www.cnn.com/2024/08/12/politics/harris-suburban-challenge-pennsylvania/index.html|||https://www.foxnews.com/media/axelrod-says-upscale-nc-harris-voters-find-way-vote-after-storm-not-sure-about-rural-trump-fans|||https://www.washingtonpost.com/politics/2024/09/13/harris-trump-puerto-rican-voters-pennsylvania/,harris|||voter,0.5628189444541931
87,"Elon Musk bows to pressure from Brazil’s top court in a bid to reinstate X|||Judge lifts suspension of X in Brazil after it meets court’s demandsThe platform has paid off its fines, suspended accounts deemed to have broken Brazilian law, and appointed a legal representative in the country.By Terrence McCoy and Marina DiasOctober 8, 2024|||Brazil Unblocks X After Musk Backs Down",https://www.cnn.com/2024/09/23/tech/elon-musk-brazil-court-compliance/index.html|||https://www.washingtonpost.com/world/2024/10/08/brazilian-judge-lifts-suspension-x-after-it-cedes-courts-demands/|||https://www.nytimes.com/2024/10/08/world/americas/brazil-x-ban-musk.html,brazil|||court|||musk,0.562095046043396
88,The future of smartphones|||Intuitive Machines and Nokia Bell Labs|||Apple iPhone 16: Speculation abounds about the latest phone and announcement date,https://www.washingtonpost.com/opinions/2024/09/12/cartoon-pritchett-smartphones-future/|||https://www.cnn.com/2024/04/24/tech/nokia-moon-4g-network-nasa-spc/index.html|||https://www.foxbusiness.com/technology/apple-iphone-16-speculation-abounds-about-latest-phone-announcement-date,future|||smartphone|||bell|||intuitive|||labs|||machine|||nokia|||announcement|||apple|||date|||iphone|||late|||phone|||speculation,0.5604720413684845
89,"How Gaza’s hospitals became battlegrounds|||‘There is no life’ after Oct 7: An Israeli mother grapples with grief one year after Hamas’ devastating attack|||Gaza’s Schools Are for Learning, Not for Dying",https://www.cnn.com/interactive/2024/01/middleeast/gaza-hospitals-destruction-investigation-intl-cmd/|||https://www.foxnews.com/media/there-no-life-after-oct-7-israeli-mother-grapples-grief-one-year-after-hamas-devastating-attack|||https://www.nytimes.com/2024/10/06/opinion/schools-shelters-gaza-israel.html,gaza,0.5593529343605042
90,"Biden urges Israel and Hezbollah to step back from all-out warThe president delivered his final talk to the United Nations on Tuesday after decades in foreign policy. The Israel-Hezbollah conflict hung over his remarks.By Yasmeen Abutaleb, Michael Birnbaum and John HudsonSeptember 24, 2024|||Is the UN past the point of no return? World leaders debate in New York next week|||How Biden’s Middle East Policy Fell Apart",https://www.washingtonpost.com/politics/2024/09/24/biden-united-nations-general-assembly-israel-hezbollah/|||https://www.cnn.com/2024/09/21/world/unga-general-assembly-world-leaders-intl-latam/index.html|||https://www.nytimes.com/2024/10/08/opinion/ezra-klein-podcast-franklin-foer.html,biden|||hezbollah|||israel|||policy,0.5576171576976776
91,Harris does interview with raunchy sex and relationship podcast as she continues to avoid many news outlets|||The ‘feral 25-year-olds’ making Kamala Harris go viral on TikTok|||13 Things We Learned From Harris’s Interview With Howard Stern,https://www.foxnews.com/media/harris-does-interview-raunchy-sex-relationship-podcast-she-continues-avoid-many-news-outlets|||https://www.washingtonpost.com/technology/2024/09/13/harris-tiktok-social-media-team/|||https://www.nytimes.com/2024/10/08/us/politics/harris-howard-stern-interview.html,harris,0.5575355887413025
92,"Fact check: 12 election lies Trump is using to set the stage to dispute a potential 2024 defeat|||If 2024 polling errors mirror those in 2020 election, Trump 'wins in a blowout,' CNN data guru says|||Trump uses debate to spread election falsehoods, defend role in riotSeptember 11",https://www.cnn.com/2024/09/30/politics/fact-check-trump-election-lies-2024/index.html|||https://www.foxnews.com/media/2024-polling-errors-mirror-those-2020-election-trump-wins-blowout-cnn-data-guru-says|||https://www.washingtonpost.com/politics/2024/09/11/trump-jan-6-election-falsehoods-debate/,election|||trump,0.5571660399436951
93,Israeli Amb: ‘We will not heal’ until hostages are home|||Rising from the ashes: Israelis in nation's war-torn south move home a year after October 7 massacre|||Biden’s Moral Failure in Israel,https://www.cnn.com/2024/10/07/world/video/the-lead-michael-herzog-oct-7-hamas-gaza-israel-hostages-one-year-jake-tapper|||https://www.foxnews.com/world/rising-from-ashes-israelis-nations-war-torn-south-move-home-year-after-oct-7-massacre|||https://www.nytimes.com/2024/10/08/opinion/bidens-moral-failure-in-israel.html,amb|||biden|||failure|||home|||hostage|||israel|||israeli|||moral|||ashe|||israelis|||massacre|||nation|||october|||south|||war|||year,0.5570465624332428
94,Supreme Court boots Elon Musk’s fight with Jack Smith over Trump’s Twitter records|||Fox News Politics: Jack Smith Strikes Back|||Jack Smith lays out Jan. 6 case against Trump. Will filing be public?,https://www.cnn.com/2024/10/07/politics/elon-musk-trump-twitter-records/index.html|||https://www.foxnews.com/politics/fox-news-politics-jack-smith-strikes-back|||https://www.washingtonpost.com/dc-md-va/2024/09/26/trump-jan-6-case-filing-under-seal/,jack|||smith|||trump,0.5564457774162292
95,"Palestinians evacuating northern Gaza say they are being shot at by Israeli military|||Hamas launches rockets from Gaza one year after Oct. 7 attacks, while IDF strikes terror targets|||Wednesday Briefing: An Israeli Airstrike in Syria",https://www.cnn.com/2024/10/08/middleeast/gaza-jabalya-idf-shooting-intl/index.html|||https://www.foxnews.com/world/hamas-launches-rockets-from-gaza-one-year-after-oct-7-attacks-while-idf-strikes-terror-targets|||https://www.nytimes.com/2024/10/08/briefing/israel-syria-trump-putin-india.html,gaza|||israeli,0.5533920526504517
96,"Harris erases Trump’s cash edge while RFK Jr. faces dwindling resources, new filings show|||AnalysisTrump campaign ad falsely claims Harris will raise taxes on familiesNew ad clips, snips and twists so many things that nearly every frame is deceptive.By Glenn KesslerOctober 4, 2024|||On Drug Prices, Harris Pushes for Deeper Cuts While Trump Offers Few Specifics",https://www.cnn.com/2024/08/21/politics/cash-advantage-harris-trump-rfk-filings/index.html|||https://www.washingtonpost.com/politics/2024/10/04/trump-campaign-ad-falsely-claims-harris-will-raise-taxes-families/|||https://www.nytimes.com/2024/10/08/health/drug-prices-kamala-harris-donald-trump.html,ad|||harris|||trump,0.5527869164943695
97,"Harris says it’s ‘not the 1950s anymore’ in dismissing criticism over not having biological children|||Harris echoes debunked claim about Georgia abortion limits causing woman's death despite pushback from doctors|||ColumnJD Vance’s repeated digs at childless women are worse than you thoughtIt’s not about the kids they don’t have. It’s about the empathy he can’t even fathom.By Monica HesseSeptember 4, 2024",https://www.cnn.com/2024/10/06/politics/harris-call-her-daddy-criticism-biological-children/index.html|||https://www.foxnews.com/media/harris-echoes-debunked-claim-about-georgia-abortion-limits-causing-womans-death-despite-pushback-from-doctors|||https://www.washingtonpost.com/style/power/2024/09/04/jd-vance-women-children/,harris|||woman,0.5526805520057678
98,"Home of famed Masters golf tournament announces joint $5 million donation toward Hurricane Helene relief|||NFL QBs Team Up, Give Big Donations To Hurricane Helene Relief|||Augusta chairman confident Masters will go on as club focuses on community recovery from HeleneMasters chairman Fred Ridley says Augusta National sustained a lot of damage from Hurricane Helene, just like the rest of the areaBy Doug Ferguson | APOctober 3, 2024",https://www.cnn.com/2024/10/03/sport/masters-donation-hurricane-helene-relief-spt-intl/index.html|||https://www.outkick.com/sports/nfl-qbs-donate-hurricane-helene-relief|||https://www.washingtonpost.com/sports/golf/2024/10/03/augusta-national-hurricane-helene/62064984-819d-11ef-90f2-d1fc6303655d_story.html,augusta|||chairman|||donation|||helene|||hurricane|||master|||relief,0.551790326833725
99,"Jill Biden takes on new surrogate role with first campaign swing for Harris|||Kamala Harris campaign frustrated by recent Biden media appearances, says CNN reporter|||EARLY BRIEFAnalysisHarris multiplied Biden’s lead among young votersIn today’s edition … Romney declines to endorse Harris over ideological differences ... DNC to spend in every U.S. state and territory.By Theodoric Meyer, Leigh Ann Caldwell and Alec DentSeptember 27, 2024",https://www.cnn.com/2024/10/08/politics/jill-biden-campaign-kamala-harris/index.html|||https://www.foxnews.com/media/members-kamala-harris-campaign-frustrated-recent-biden-media-appearances-cnn-reporter|||https://www.washingtonpost.com/politics/the-briefs-newsletters/early-brief/,biden|||campaign|||harris,0.5442808568477631
100,"Prospects of a deal with Israel fade away as Saudis invite Iranian foreign minister to visit|||Regional war is effectively here. What Israel does next will be pivotal|||Israel’s Defense Minister Postpones Trip to Washington, U.S. Says",https://www.foxnews.com/politics/iran-foreign-minister-saudi-arabia-deal-israel|||https://www.cnn.com/2024/10/02/middleeast/israel-lebanon-regional-war-analysis-intl/index.html|||https://www.nytimes.com/2024/10/08/world/middleeast/gallant-austin-washington-visit-postponed.html,israel|||minister,0.5437250137329102
101,"Fact check: Trump falsely claims Harris met with Putin before Ukraine invasion|||Trump vs. Harris: The 'October surprise' is already here|||Harris Cracks a Beer With Colbert and Talks Gaza, Trump and Putin",https://www.cnn.com/2024/08/21/politics/fact-check-trump-harris-putin-meeting-ukraine/index.html|||https://www.foxnews.com/opinion/trump-vs-harris-october-surprise-already-here|||https://www.nytimes.com/2024/10/08/us/politics/kamala-harris-colbert-report.html,harris|||putin|||trump,0.5428355932235718
102,Israel’s economy is paying a high price for its widening war|||Under fire: Israel's Iron Dome winning but pressure's on as conflict with Iran escalates|||We Should Want Israel to Win,https://www.cnn.com/2024/10/04/economy/israel-economy-war-impact/index.html|||https://www.foxnews.com/world/under-fire-israels-iron-dome-winning-pressures-conflict-iran-escalates|||https://www.nytimes.com/2024/10/08/opinion/israel-lebanon-iran-gaza.html,israel,0.5424093008041382
103,"Too much misinformation and not enough money as hurricanes hit an election year|||WATCH: Trump rips into Biden admin over report about hurricane funds|||AnalysisThe hurricane X-factor in the 2024 electionPrevious hurricanes have reduced voter turnout in hard-hit areas and both helped and hurt incumbents. This fall’s storms affect particularly crucial electoral regions.By Aaron BlakeOctober 8, 2024",https://www.cnn.com/2024/10/07/politics/misinformation-hurricanes-what-matters/index.html|||https://www.foxbusiness.com/video/6362855282112|||https://www.washingtonpost.com/politics/2024/10/08/hurricane-x-factor-2024-election/,hurricane,0.5402223169803619
104,Deloitte feels the wrath of Trump world over employee’s leaked JD Vance messages|||How JD Vance underlined Trump’s worst vulnerabilitiesOpinion by Jennifer Rubin|||JD Vance and the Prophets of Trumpism,https://www.cnn.com/2024/10/08/business/deloitte-trump-leaked-jd-vance-messages/index.html|||https://www.washingtonpost.com/opinions/2024/10/06/vance-debate-trump-problems/|||https://www.nytimes.com/2024/10/06/opinion/jd-vance-lance-wallnau-seven-mountains.html,vance,0.5382892191410065
105,"I’ve tried the best coffee from around the world. I still don’t like it|||Starbucks ranked last by coffee lovers in key category among rivals|||(Illustration by Min Heo for The Washington Post)BY THE WAYGuest columnMy secret to finding the best coffee? Look for two-star reviews.Between stand-up gigs on the road, comedian Alex Falcone looks for coffee shop reviews that are begrudgingly good.By Alex FalconeOctober 4, 2024",https://www.cnn.com/travel/why-i-hate-drinking-coffee/index.html|||https://www.foxbusiness.com/lifestyle/coffee-customers-rank-starbucks-last-among-competitors-key-category-report-says|||https://www.washingtonpost.com/travel/tips/best-coffee-shops-two-star-reviews/,alex|||coffee|||good,0.538036584854126
106,"Harris’ border visit and economy speech capture attention as warning signs emerge for campaign|||Harris campaign is in 'danger zone' as Americans worry about country's direction, says CNN data guru|||Jobs Report Adds to Economic Momentum for Harris",https://www.cnn.com/2024/10/06/politics/breakthrough-polling-project-harris-lie/index.html|||https://www.foxnews.com/media/harris-campaign-danger-zone-americans-worry-countrys-direction|||https://www.nytimes.com/2024/10/04/business/jobs-report-harris-economy.html,campaign|||harris,0.5366270542144775
107,"Business owner: Big tech can take American dream 'away in a heartbeat.' How the parallel economy fights back|||AI’s impact on businesses, consumers and employeesAcross industries, artificial intelligence is already aiding in the customer experience, optimizing data in new ways, writing code and more. On Wednesday, Oct. 2, join Washington Post Live for conversations with MIT economics professor David Autor and other experts diving deeper into the impact of AI on America’s businesses, workforce and economy.October 2|||The Job Market Is Chugging Along, Completing a Solid Economic Picture",https://www.foxnews.com/media/business-owner-big-tech-take-american-dream-away-heartbeat-parallel-economy-fights-back|||https://www.washingtonpost.com/washington-post-live/2024/10/02/ais-impact-businesses-consumers-employees/|||https://www.nytimes.com/2024/10/04/business/economy/job-market-hiring-wage.html,business|||economic|||impact,0.5337664484977722
108,"UFC star assisting in Helene rescue efforts says FEMA abandoned North Carolina: 'Still woefully absent'|||Before-and-after images show Helene wiped parts of North Carolina off the map|||FEMA deploys to rough terrain after Helene as it faces criticism, fights misinformationThe Federal Emergency Management Agency is facing logistical challenges and misinformation in its response to Hurricane Helene.By Molly Hennessy-Fiske, Maxine Joselow, Clara Ence Morse and Will OremusOctober 4, 2024",https://www.foxnews.com/media/ufc-star-assisting-helene-rescue-efforts-says-fema-abandoned-north-carolina-still-woefully-absent|||https://www.cnn.com/2024/10/03/weather/hurricane-helene-north-carolina-before-after-images-climate/index.html|||https://www.washingtonpost.com/climate-environment/2024/10/04/fema-hurricane-helene-relief-money-misinformation-conspiracies/,carolina|||fema|||helene|||north,0.533329576253891
109,"No, dude, Monica McNutt does not need your WNBA takeThe men of sports media are talking a lot about women’s hoops these days. ESPN’s Monica McNutt is here to help – and occasionally shut them up.By Ben StraussSeptember 19, 2024|||New York Liberty end Las Vegas Aces’ bid for a three-peat, advance to WNBA Finals|||Jemele Hill rips 'irresponsible headlines' on Caitlin Clark's WNBA ratings impact before proving their point",https://www.washingtonpost.com/sports/2024/09/19/monica-mcnutt-espn-stephen-smith/|||https://www.cnn.com/2024/10/06/sport/liberty-defeat-aces-advance-to-wnba-finals-spt-intl/index.html|||https://www.foxnews.com/sports/jemele-hill-rips-irresponsible-headlines-caitlin-clarks-wnba-ratings-impact-before-proving-point,mcnutt|||monica|||wnba,0.531795084476471
110,Google’s search dominance is unwinding|||(Monica Rodman/The Washington Post)Google says changing your search engine is easy. It's not.|||How Google Was Forced to Open Up,https://www.cnn.com/2024/10/08/business/google-search-amazon-nightcap/index.html|||https://www.washingtonpost.com/video/technology/google-says-changing-your-search-engine-is-easy-its-not/2023/11/08/31ec1ff4-c92f-4a7c-9d99-7a61e6593c56_video.html|||https://www.nytimes.com/2024/10/08/business/dealbook/google-epic-app-store.html,google|||search,0.5298237502574921
